{"schema_version":"oaw.profile-recipe/v2","recipe_version":"2.0.0","id":"oaw/ecc-engineering","display_name":"ECC Engineering","required_responsibilities":["requirements","domain-modeling","specification","ticket-decomposition","implementation-planning","workspace","delegation","implementation","tdd","functional-debugging","build-repair","dependency-repair","type-repair","review","remediation","verification","completion"],"nodes":[
{"id":"requirements","kind":"phase","responsibility":"requirements","selector":{"provider_id":"oaw/ecc","capability_id":"planning"},"transitions":[{"signal":"succeeded","target":"domain-modeling"}]},
{"id":"domain-modeling","kind":"phase","responsibility":"domain-modeling","selector":{"provider_id":"oaw/ecc","capability_id":"planning"},"transitions":[{"signal":"succeeded","target":"specification"}]},
{"id":"specification","kind":"phase","responsibility":"specification","selector":{"provider_id":"oaw/ecc","capability_id":"planning"},"transitions":[{"signal":"succeeded","target":"ticket-decomposition"}]},
{"id":"ticket-decomposition","kind":"phase","responsibility":"ticket-decomposition","selector":{"provider_id":"oaw/ecc","capability_id":"planning"},"transitions":[{"signal":"succeeded","target":"implementation-planning"}]},
{"id":"implementation-planning","kind":"phase","responsibility":"implementation-planning","selector":{"provider_id":"oaw/ecc","capability_id":"planning"},"transitions":[{"signal":"succeeded","target":"workspace"}]},
{"id":"workspace","kind":"phase","responsibility":"workspace","selector":{"provider_id":"oaw/ecc","capability_id":"implementation"},"transitions":[{"signal":"succeeded","target":"implementation"}]},
{"id":"implementation","kind":"phase","responsibility":"implementation","selector":{"provider_id":"oaw/ecc","capability_id":"implementation"},"transitions":[{"signal":"succeeded","target":"review"}]},
{"id":"delegation","kind":"procedure","responsibility":"delegation","selector":{"provider_id":"oaw/ecc","capability_id":"implementation"},"phase":"implementation","transitions":[]},
{"id":"tdd","kind":"procedure","responsibility":"tdd","selector":{"provider_id":"oaw/ecc","capability_id":"tdd"},"phase":"implementation","transitions":[]},
{"id":"functional-debugging","kind":"incident-handler","responsibility":"functional-debugging","selector":{"provider_id":"oaw/ecc","capability_id":"functional-debugging"},"transitions":[{"signal":"succeeded","target":"remediation"}]},
{"id":"build-repair","kind":"incident-handler","responsibility":"build-repair","selector":{"provider_id":"oaw/ecc","capability_id":"build-repair"},"transitions":[{"signal":"succeeded","target":"remediation"}]},
{"id":"dependency-repair","kind":"incident-handler","responsibility":"dependency-repair","selector":{"provider_id":"oaw/ecc","capability_id":"build-repair"},"transitions":[{"signal":"succeeded","target":"remediation"}]},
{"id":"type-repair","kind":"incident-handler","responsibility":"type-repair","selector":{"provider_id":"oaw/ecc","capability_id":"build-repair"},"transitions":[{"signal":"succeeded","target":"remediation"}]},
{"id":"review","kind":"phase","responsibility":"review","selector":{"provider_id":"oaw/ecc","capability_id":"review"},"transitions":[{"signal":"succeeded","target":"verification"},{"signal":"finding","target":"remediation"}]},
{"id":"remediation","kind":"phase","responsibility":"remediation","selector":{"provider_id":"oaw/ecc","capability_id":"remediation"},"transitions":[{"signal":"remediated","target":"review"}]},
{"id":"verification","kind":"phase","responsibility":"verification","selector":{"provider_id":"oaw/ecc","capability_id":"verification"},"transitions":[{"signal":"succeeded","target":"completion"},{"signal":"finding","target":"remediation"}]},
{"id":"completion","kind":"gate","responsibility":"completion","selector":{"provider_id":"oaw/ecc","capability_id":"completion"},"transitions":[]}
],"incident_routes":[{"incident":"functional-failure","handler":"functional-debugging"},{"incident":"build-failure","handler":"build-repair"},{"incident":"dependency-failure","handler":"dependency-repair"},{"incident":"type-failure","handler":"type-repair"}],"entry":"requirements","terminal_gates":["completion"],"stable_boundaries":["specification-approved","ticket-complete","tdd-cycle-complete","debugging-cycle-complete","review-complete","verification-complete"],"environment_requirements":[]}
